{"request_schema_version":"evaluation_request_v0.2","split":"DEV","contract_identity":{"protocol_version":"eval_protocol_v0.2.2","taxonomy_version":"execution_taxonomy_v0.1","agent_output_schema_version":"agent_output_v0.1.1","mapping_spec_version":"xbrl_gold_mapping_spec_v0.1.2","evaluator_contract_version":"d2_contract_v0.2","xbrl_artifact_fingerprint":"acaf087ee2c4fb7427377cae5f1968da26c75d4dfa565f67f1e056b2c4cc4eb6","corpus_fingerprint":"56df698d50b13cf15e913c1c60dbc96b1fd0fab44adb7b1f40ba99771c4b7c96"},"gold_bundle":{"bundle_schema_version":"gold_bundle_v0.2","adapter_version":"gold_bundle_adapter_v0.2","source_format_version":"gold_bundle_v0.2","source_sha256":"8fc0ef247b85462575e93994c5188b2a32144fa88b73a6c9445481a9918a03de","question_id":"AUDIT_INDEPENDENT","numeric_targets":[{"target_id":"audit.leaf","accepted_value":"37.4","unit":"USD","period":"FY2025","basis":"reported","precision":{"precision_schema_version":"precision_record_v0.2","mode":"EXACT","quantum":null,"absolute_tolerance":null,"rounding_mode":null,"source_encoding":"independent_audit","source_value":null,"precision_rule_id":"precision_exact_v0.1","comparison_unit":"USD","reference_value":"37.4","interval":{"lower":"37.4","upper":"37.4","lower_inclusive":true,"upper_inclusive":true}},"variant_family":null,"approved_chunk_paths":[{"path_id":"audit.path.1","members":[{"chunk_id":"audit.chunk.1","accession":"0000000097-25-000019","locator":"audit/table/1"}]}],"approved_xbrl_paths":[]},{"target_id":"audit.derived","accepted_value":"37","unit":"USD","period":"FY2025","basis":"reported","precision":{"precision_schema_version":"precision_record_v0.2","mode":"ABS_TOLERANCE","quantum":null,"absolute_tolerance":"0.5","rounding_mode":null,"source_encoding":"independent_audit","source_value":"0.5","precision_rule_id":"precision_absolute_tolerance_v0.1","comparison_unit":"USD","reference_value":"37","interval":{"lower":"36.5","upper":"37.5","lower_inclusive":true,"upper_inclusive":true}},"variant_family":null,"approved_chunk_paths":[],"approved_xbrl_paths":[]}],"answer_groups":[{"answer_group_id":"audit.group","multiplicity":1,"question_consistency_group":null,"variants":[{"accepted_value":"37","unit":"USD","period":"FY2025","basis":"reported","precision":{"precision_schema_version":"precision_record_v0.2","mode":"ABS_TOLERANCE","quantum":null,"absolute_tolerance":"0.5","rounding_mode":null,"source_encoding":"independent_audit","source_value":"0.5","precision_rule_id":"precision_absolute_tolerance_v0.1","comparison_unit":"USD","reference_value":"37","interval":{"lower":"36.5","upper":"37.5","lower_inclusive":true,"upper_inclusive":true}},"variant_family":null,"approved_chunk_paths":[],"approved_xbrl_paths":[],"numeric_target_id":"audit.derived","variant_id":"AuditVariant","sign_policy":"SIGNED_EXACT","derived_specification":{"derived_target_id":"audit.derived","required_inputs":[{"input_role":"leaf","source_target_id":"audit.leaf","source_answer_group_id":null}],"allowed_formula_variants":[{"formula_variant_id":"audit.identity","canonical_formula":"leaf"}],"output_unit":"USD","output_precision":{"precision_schema_version":"precision_record_v0.2","mode":"EXACT","quantum":null,"absolute_tolerance":null,"rounding_mode":null,"source_encoding":"independent_audit","source_value":null,"precision_rule_id":"precision_exact_v0.1","comparison_unit":"USD","reference_value":"37","interval":{"lower":"37","upper":"37","lower_inclusive":true,"upper_inclusive":true}}}}]}],"judge_dependent_gold":{"items":[]}},"slot_record":{"slot_record_schema_version":"evaluation_slot_record_v0.2","adapter_version":"evaluation_slot_record_adapter_v0.2","question_id":"AUDIT_INDEPENDENT","scheduled_replicate_id":"audit.replica","scheduled_slot_id":"audit.slot","effective_attempt_id":"audit.original","replacement_for_slot_id":null,"execution_status":"RUN_COMPLETED","agent_output_present":true,"infrastructure_exhausted":false,"observable_runtime_references":[],"attempts":[{"attempt_id":"audit.original","execution_status":"RUN_COMPLETED","replacement_for_attempt_id":null}],"events":[]},"chunk_catalog":[{"chunk_id":"audit.chunk.1","accession":"0000000097-25-000019","locator":"audit/table/1","source_allowed":true},{"chunk_id":"audit.chunk.2","accession":"0000000097-25-000019","locator":"audit/table/2","source_allowed":true},{"chunk_id":"audit.chunk.3","accession":"0000000097-25-000019","locator":"audit/table/3","source_allowed":true},{"chunk_id":"audit.chunk.4","accession":"0000000097-25-000019","locator":"audit/table/4","source_allowed":true}],"normalized_xbrl_map":null,"frozen_xbrl_fact_index":null,"xbrl_numeric_values":[],"agent_output_json":"{\"schema_version\":\"agent_output_v0.1.1\",\"q_id\":\"AUDIT_INDEPENDENT\",\"answer\":\"Synthetic audit answer\",\"answer_claim_ids\":[\"C901\"],\"claims\":[{\"claim_id\":\"C901\",\"text\":\"Synthetic audit claim\",\"claim_type\":\"numeric\",\"entities\":[\"Audit Entity\"],\"material\":true,\"period\":\"FY2025\",\"requires_citation\":false,\"temporal_role\":\"current\",\"numeric_value\":{\"value\":37.4,\"unit\":\"USD\",\"period\":\"FY2025\",\"basis\":\"reported\",\"display_value\":\"37\"},\"provenance\":[],\"calculation_ids\":[\"K901\"]}],\"calculations\":[{\"calculation_id\":\"K901\",\"expression\":\"I901\",\"inputs\":[{\"input_id\":\"I901\",\"name\":\"leaf\",\"value\":37.4,\"unit\":\"USD\",\"period\":\"FY2025\",\"basis\":\"reported\",\"source_type\":\"cited_fact\",\"provenance\":[{\"provenance_type\":\"chunk\",\"chunk_id\":\"audit.chunk.1\",\"accession\":\"0000000097-25-000019\",\"locator\":\"audit/table/1\"}]}],\"result\":{\"value\":37.4,\"unit\":\"USD\",\"display_value\":\"37\"}}]}","agent_output_sha256":"bd84df6f61f0a9205f83253d9454f67f89685d4fac9edbd293b31bc34a08f2c0"}